{"attempts":[{"attemptId":"1b2c3d4e-5f6a-4b8c-9d0e-1f2a3b4c5d11","attemptOrdinal":1,"receipt":{"byteLength":2852,"digest":"sha256:1d42dc1b11a75e76baa587472fb07228a39a9dce4eb23b6be9ade42868869a2c","mediaType":"application/vnd.rawframe.evidence.raw-run-receipt.v1+json"},"repetitionOrdinal":1},{"attemptId":"1b2c3d4e-5f6a-4b8c-9d0e-1f2a3b4c5d12","attemptOrdinal":2,"receipt":{"byteLength":2852,"digest":"sha256:58a1919466cf1c87e9245ad9d0bbf7a8d86b9b5037cb8bca249324c0c1549fd6","mediaType":"application/vnd.rawframe.evidence.raw-run-receipt.v1+json"},"repetitionOrdinal":2},{"attemptId":"1b2c3d4e-5f6a-4b8c-9d0e-1f2a3b4c5d13","attemptOrdinal":3,"receipt":{"byteLength":2852,"digest":"sha256:23cf5ccb806160bd933b5eacbf2c1278f41d6cb8b3a886d5d1872ff85fd645f1","mediaType":"application/vnd.rawframe.evidence.raw-run-receipt.v1+json"},"repetitionOrdinal":3},{"attemptId":"1b2c3d4e-5f6a-4b8c-9d0e-1f2a3b4c5d14","attemptOrdinal":4,"receipt":{"byteLength":2852,"digest":"sha256:99cba236f549cd3cafca2d4a5b1e7284abc2e91b745b48f632f4465305863061","mediaType":"application/vnd.rawframe.evidence.raw-run-receipt.v1+json"},"repetitionOrdinal":4}],"planId":"eb558211-8a41-489c-82f0-3b434e072e66","recordKind":"attempt_plan","schedule":{"attemptCount":5,"repetitionCount":4},"schemaVersion":1,"tier":"tier_0"}