{"attempts":[{"attemptId":"1b2c3d4e-5f6a-4b8c-9d0e-1f2a3b4c5d46","attemptOrdinal":1,"receipt":{"byteLength":3107,"digest":"sha256:fa4bec3c40fe452217c06d3068e3d3c8258cee3d52b49f20fc1d46925cd41801","mediaType":"application/vnd.rawframe.evidence.raw-run-receipt.v1+json"},"repetitionOrdinal":1}],"planId":"c1a20001-0000-4000-8000-000000000005","recordKind":"attempt_plan","schedule":{"attemptCount":1,"repetitionCount":1},"schemaVersion":1,"tier":"tier_0"}