{"attempts":[{"attemptId":"1b2c3d4e-5f6a-4b8c-9d0e-1f2a3b4c5d11","attemptOrdinal":1,"receipt":{"byteLength":2852,"digest":"sha256:1d42dc1b11a75e76baa587472fb07228a39a9dce4eb23b6be9ade42868869a2c","mediaType":"application/vnd.rawframe.evidence.raw-run-receipt.v1+json"},"repetitionOrdinal":1},{"attemptId":"1b2c3d4e-5f6a-4b8c-9d0e-1f2a3b4c5d12","attemptOrdinal":2,"receipt":{"byteLength":2852,"digest":"sha256:58a1919466cf1c87e9245ad9d0bbf7a8d86b9b5037cb8bca249324c0c1549fd6","mediaType":"application/vnd.rawframe.evidence.raw-run-receipt.v1+json"},"repetitionOrdinal":2},{"attemptId":"1b2c3d4e-5f6a-4b8c-9d0e-1f2a3b4c5d13","attemptOrdinal":3,"receipt":{"byteLength":2852,"digest":"sha256:23cf5ccb806160bd933b5eacbf2c1278f41d6cb8b3a886d5d1872ff85fd645f1","mediaType":"application/vnd.rawframe.evidence.raw-run-receipt.v1+json"},"repetitionOrdinal":3},{"attemptId":"1b2c3d4e-5f6a-4b8c-9d0e-1f2a3b4c5d18","attemptOrdinal":4,"receipt":{"byteLength":2852,"digest":"sha256:c0c53068e873177a266407507972d28a41bdfb42b30df1307b499938642c85a7","mediaType":"application/vnd.rawframe.evidence.raw-run-receipt.v1+json"},"repetitionOrdinal":4},{"attemptId":"1b2c3d4e-5f6a-4b8c-9d0e-1f2a3b4c5d15","attemptOrdinal":5,"receipt":{"byteLength":2852,"digest":"sha256:d03af7b3d2a6d0b58de39cc43b57c0c40cdf2ab73ec029abc158bf10938d923c","mediaType":"application/vnd.rawframe.evidence.raw-run-receipt.v1+json"},"repetitionOrdinal":5}],"planId":"62a8b13d-cc54-4141-8358-086b4a60ef38","recordKind":"attempt_plan","schedule":{"attemptCount":5,"repetitionCount":5},"schemaVersion":1,"tier":"tier_0"}