{"attempts":[{"attemptId":"1b2c3d4e-5f6a-4b8c-9d0e-1f2a3b4c5d11","attemptOrdinal":1,"receipt":{"byteLength":2852,"digest":"sha256:1d42dc1b11a75e76baa587472fb07228a39a9dce4eb23b6be9ade42868869a2c","mediaType":"application/vnd.rawframe.evidence.raw-run-receipt.v1+json"},"repetitionOrdinal":1},{"attemptId":"1b2c3d4e-5f6a-4b8c-9d0e-1f2a3b4c5d16","attemptOrdinal":2,"receipt":{"byteLength":3122,"digest":"sha256:509e1dc7d31de9a7d26542cddb1c733a8e82445a59e40b3609e00e4e89ae2da2","mediaType":"application/vnd.rawframe.evidence.raw-run-receipt.v1+json"},"repetitionOrdinal":2},{"attemptId":"1b2c3d4e-5f6a-4b8c-9d0e-1f2a3b4c5d17","attemptOrdinal":3,"receipt":{"byteLength":3132,"digest":"sha256:ad13ab56bb49c64840ed466b13a7d95aceb18487b23aec8d0752ff8d6a6e29f0","mediaType":"application/vnd.rawframe.evidence.raw-run-receipt.v1+json"},"repetitionOrdinal":3},{"attemptId":"1b2c3d4e-5f6a-4b8c-9d0e-1f2a3b4c5d30","attemptOrdinal":4,"receipt":{"byteLength":3126,"digest":"sha256:71f8a956bf0476960c6c4806d6bcd14a4ba127a1d6cdc75af05713faa3b724f8","mediaType":"application/vnd.rawframe.evidence.raw-run-receipt.v1+json"},"repetitionOrdinal":4},{"attemptId":"1b2c3d4e-5f6a-4b8c-9d0e-1f2a3b4c5d31","attemptOrdinal":5,"receipt":{"byteLength":3133,"digest":"sha256:0cb131bf18f22d0caed1237dc81f38d0ed93e0f22ec0b3f38f45d5b8c7d1e3e3","mediaType":"application/vnd.rawframe.evidence.raw-run-receipt.v1+json"},"repetitionOrdinal":5}],"planId":"5968f8e7-b512-4481-8a7c-b9f6e3fd6cec","recordKind":"attempt_plan","schedule":{"attemptCount":5,"repetitionCount":5},"schemaVersion":1,"tier":"tier_0"}