{"attempts":[{"attemptId":"1b2c3d4e-5f6a-4b8c-9d0e-1f2a3b4c5d11","attemptOrdinal":1,"receipt":{"byteLength":2852,"digest":"sha256:1d42dc1b11a75e76baa587472fb07228a39a9dce4eb23b6be9ade42868869a2c","mediaType":"application/vnd.rawframe.evidence.raw-run-receipt.v1+json"},"repetitionOrdinal":1},{"attemptId":"1b2c3d4e-5f6a-4b8c-9d0e-1f2a3b4c5d12","attemptOrdinal":2,"receipt":{"byteLength":2852,"digest":"sha256:58a1919466cf1c87e9245ad9d0bbf7a8d86b9b5037cb8bca249324c0c1549fd6","mediaType":"application/vnd.rawframe.evidence.raw-run-receipt.v1+json"},"repetitionOrdinal":2},{"attemptId":"1b2c3d4e-5f6a-4b8c-9d0e-1f2a3b4c5d16","attemptOrdinal":3,"receipt":{"byteLength":3122,"digest":"sha256:509e1dc7d31de9a7d26542cddb1c733a8e82445a59e40b3609e00e4e89ae2da2","mediaType":"application/vnd.rawframe.evidence.raw-run-receipt.v1+json"},"repetitionOrdinal":9}],"planId":"6615a660-3eea-4f68-8aaf-6e78359e8491","recordKind":"attempt_plan","schedule":{"attemptCount":3,"repetitionCount":3},"schemaVersion":1,"tier":"tier_0"}