{"attempts":[{"attemptId":"1b2c3d4e-5f6a-4b8c-9d0e-1f2a3b4c5d41","attemptOrdinal":1,"receipt":{"byteLength":3109,"digest":"sha256:665b0cf40e1b876cb856e6eb17a403f2b7740f59ea981e8651211bf924e6196c","mediaType":"application/vnd.rawframe.evidence.raw-run-receipt.v1+json"},"repetitionOrdinal":1},{"attemptId":"1b2c3d4e-5f6a-4b8c-9d0e-1f2a3b4c5d48","attemptOrdinal":2,"receipt":{"byteLength":3210,"digest":"sha256:43843b12379e881ffb29ee7decd33771ece93cd83944919993dcd798aa36b80f","mediaType":"application/vnd.rawframe.evidence.raw-run-receipt.v1+json"},"repetitionOrdinal":2}],"planId":"c1a20001-0000-4000-8000-000000000007","recordKind":"attempt_plan","schedule":{"attemptCount":2,"repetitionCount":2},"schemaVersion":1,"tier":"tier_0"}