{"attempts":[{"attemptId":"1b2c3d4e-5f6a-4b8c-9d0e-1f2a3b4c5d51","attemptOrdinal":1,"receipt":{"byteLength":3109,"digest":"sha256:7b171535373925aa2f1e342f1ec78e8baf9bcd50c1ef1856e909369a01c34c4f","mediaType":"application/vnd.rawframe.evidence.raw-run-receipt.v1+json"},"repetitionOrdinal":1}],"planId":"c1a20001-0000-4000-8000-00000000000a","recordKind":"attempt_plan","schedule":{"attemptCount":1,"repetitionCount":1},"schemaVersion":1,"tier":"tier_0"}